{
  "id": "title-theme",
  "name": "Title Screen",
  "bpm": 130,
  "timbrePack": "16bit-sfc",
  "config": {
    "loop": true,
    "reverb": "room"
  },
  "tracks": [
    {
      "timbre": "lead",
      "performance": {
        "layback": 15,
        "humanize": 0.2,
        "velocityCurve": [[0, 0.5], [4, 0.9], [8, 0.5], [16, 0.5], [20, 0.9], [24, 0.5]]
      },
      "notes": [
        { "note": "E5", "duration": "q" },
        { "note": "G5", "duration": "q" },
        { "note": "A5", "duration": "h" },
        { "note": "G5", "duration": "q", "offset": 25 },
        { "note": "E5", "duration": "q" },
        { "note": "D5", "duration": "h" },
        { "note": "C5", "duration": "q" },
        { "note": "D5", "duration": "q" },
        { "note": "E5", "duration": "h" },
        { "note": "G5", "duration": "q" },
        { "note": "E5", "duration": "q" },
        { "note": "D5", "duration": "h" },
        { "note": "E5", "duration": "q" },
        { "note": "G5", "duration": "q" },
        { "note": "A5", "duration": "h" },
        { "note": "B5", "duration": "q" },
        { "note": "C6", "duration": "q" },
        { "note": "A5", "duration": "h" },
        { "note": "G5", "duration": "q" },
        { "note": "A5", "duration": "q" },
        { "note": "B5", "duration": "h" },
        { "note": "C6", "duration": "q" },
        { "note": "B5", "duration": "q" },
        { "note": "A5", "duration": "h" }
      ]
    },
    {
      "timbre": "bass",
      "performance": {
        "layback": 5
      },
      "notes": [
        { "note": "A2", "duration": "w" },
        { "note": "G2", "duration": "w" },
        { "note": "F2", "duration": "w" },
        { "note": "E2", "duration": "w" },
        { "note": "A2", "duration": "w" },
        { "note": "G2", "duration": "w" },
        { "note": "F2", "duration": "w" },
        { "note": "E2", "duration": "w" }
      ]
    },
    {
      "timbre": "arp",
      "performance": {
        "swing": 0.4
      },
      "notes": [
        { "note": "A4", "duration": "e" },
        { "note": "C5", "duration": "e" },
        { "note": "E5", "duration": "e" },
        { "note": "A5", "duration": "e" },
        { "note": "G4", "duration": "e" },
        { "note": "B4", "duration": "e" },
        { "note": "D5", "duration": "e" },
        { "note": "G5", "duration": "e" },
        { "note": "F4", "duration": "e" },
        { "note": "A4", "duration": "e" },
        { "note": "C5", "duration": "e" },
        { "note": "F5", "duration": "e" },
        { "note": "E4", "duration": "e" },
        { "note": "G4", "duration": "e" },
        { "note": "B4", "duration": "e" },
        { "note": "E5", "duration": "e" },
        { "note": "A4", "duration": "e" },
        { "note": "C5", "duration": "e" },
        { "note": "E5", "duration": "e" },
        { "note": "A5", "duration": "e" },
        { "note": "G4", "duration": "e" },
        { "note": "B4", "duration": "e" },
        { "note": "D5", "duration": "e" },
        { "note": "G5", "duration": "e" },
        { "note": "F4", "duration": "e" },
        { "note": "A4", "duration": "e" },
        { "note": "C5", "duration": "e" },
        { "note": "F5", "duration": "e" },
        { "note": "E4", "duration": "e" },
        { "note": "G4", "duration": "e" },
        { "note": "B4", "duration": "e" },
        { "note": "E5", "duration": "e" }
      ]
    },
    {
      "timbre": "kick",
      "notes": [
        { "note": "C2", "duration": "q" },
        { "note": null, "duration": "q" },
        { "note": "C2", "duration": "q" },
        { "note": null, "duration": "q" },
        { "note": "C2", "duration": "q" },
        { "note": null, "duration": "q" },
        { "note": "C2", "duration": "q" },
        { "note": null, "duration": "q" },
        { "note": "C2", "duration": "q" },
        { "note": null, "duration": "q" },
        { "note": "C2", "duration": "q" },
        { "note": null, "duration": "q" },
        { "note": "C2", "duration": "q" },
        { "note": null, "duration": "q" },
        { "note": "C2", "duration": "q" },
        { "note": null, "duration": "q" }
      ]
    },
    {
      "timbre": "hihat",
      "performance": {
        "humanize": 0.15
      },
      "notes": [
        { "note": "C6", "duration": "e" },
        { "note": null, "duration": "e" },
        { "note": "C6", "duration": "e" },
        { "note": null, "duration": "e" },
        { "note": "C6", "duration": "e" },
        { "note": null, "duration": "e" },
        { "note": "C6", "duration": "e" },
        { "note": null, "duration": "e" },
        { "note": "C6", "duration": "e" },
        { "note": null, "duration": "e" },
        { "note": "C6", "duration": "e" },
        { "note": null, "duration": "e" },
        { "note": "C6", "duration": "e" },
        { "note": null, "duration": "e" },
        { "note": "C6", "duration": "e" },
        { "note": null, "duration": "e" },
        { "note": "C6", "duration": "e" },
        { "note": null, "duration": "e" },
        { "note": "C6", "duration": "e" },
        { "note": null, "duration": "e" },
        { "note": "C6", "duration": "e" },
        { "note": null, "duration": "e" },
        { "note": "C6", "duration": "e" },
        { "note": null, "duration": "e" },
        { "note": "C6", "duration": "e" },
        { "note": null, "duration": "e" },
        { "note": "C6", "duration": "e" },
        { "note": null, "duration": "e" },
        { "note": "C6", "duration": "e" },
        { "note": null, "duration": "e" },
        { "note": "C6", "duration": "e" },
        { "note": null, "duration": "e" }
      ]
    }
  ]
}
